condition_category,condition_specific,responder_type,presumption_type,presumption_exists,rebuttable,statute_citation,years_service_required,pre_employment_exam_required,post_termination_months,post_termination_formula,discovery_during_employment_required,filing_deadline_notes,tobacco_exclusion,notes,state,state_name,iaff_url,data_retrieved,needs_verification
cardiovascular,"heart attack, stroke, vascular rupture",corrections,statute,TRUE,TRUE,O.C.G.A. § 45-9-85(b)(4),NA,NA,NA,NA,NA,Must commence within 24 hours after performing work-related activity,NA,"Statute covers 'public safety officers' defined to include prison guards. Presumption applies to heart attack, stroke, or vascular rupture within 24 hours of work-related activity. Rebuttable by competent medical evidence.",GA,Georgia,https://www.iaff.org/presumptive-health/ga/,2026-05-23,NA
cancer,"leukemia, multiple myeloma, non-Hodgkin lymphoma, cancer of the lung, brain, stomach, esophagus, intestines, rectum, kidney, bladder, prostate, breast, female reproductive organs, testes",firefighter,statute,TRUE,NA,Haw. Rev. Stat. § 386 (medical care for firefighters with cancer),5,NA,NA,NA,NA,NA,NA,"When a cancer claim is accepted as compensable for a firefighter with 5+ years of service, employer is liable for medical care at 110%-150% of Medicare RBRVS fees applicable to Hawaii. Provision is about enhanced medical benefit level, not a WC presumption per se, but applies once claim is accepted or determined compensable.",HI,Hawaii,https://www.iaff.org/presumptive-health/hi/,2026-05-23,NA
cardiovascular,disease of the heart,firefighter,statute,TRUE,TRUE,Haw. Rev. Stat. § 88-79,NA,TRUE,NA,NA,NA,NA,NA,"Applies for service-connected disability retirement. Presumption requires that entry physical exam failed to reveal any evidence of the condition. Inhalation of smoke, toxic gases, chemical fumes, and other toxic vapors shall be construed as injury received in performance of duty.",HI,Hawaii,https://www.iaff.org/presumptive-health/hi/,2026-05-23,NA
cardiovascular,disease of the heart,law_enforcement,statute,TRUE,TRUE,Haw. Rev. Stat. § 88-79,NA,TRUE,NA,NA,NA,NA,NA,Statute explicitly covers police officers. Presumption requires that entry physical exam failed to reveal any evidence of the condition.,HI,Hawaii,https://www.iaff.org/presumptive-health/hi/,2026-05-23,NA
respiratory,disease of the lungs or respiratory system,firefighter,statute,TRUE,TRUE,Haw. Rev. Stat. § 88-79,NA,TRUE,NA,NA,NA,NA,NA,"Applies for service-connected disability retirement. Presumption requires that entry physical exam failed to reveal any evidence of the condition. Inhalation of smoke, toxic gases, chemical fumes construed as occupational hazard.",HI,Hawaii,https://www.iaff.org/presumptive-health/hi/,2026-05-23,NA
respiratory,disease of the lungs or respiratory system,law_enforcement,statute,TRUE,TRUE,Haw. Rev. Stat. § 88-79,NA,TRUE,NA,NA,NA,NA,NA,Statute explicitly covers police officers. Presumption requires that entry physical exam failed to reveal any evidence of the condition.,HI,Hawaii,https://www.iaff.org/presumptive-health/hi/,2026-05-23,NA
cancer,"prostate cancer, primary brain cancer, breast cancer, ovarian cancer, cervical cancer, uterine cancer, malignant melanoma, leukemia, non-Hodgkin's lymphoma, bladder cancer, colorectal cancer, multiple myeloma, testicular cancer, kidney cancer",firefighter,statute,TRUE,TRUE,Iowa Code § 411.6(5); § 411.1(6),NA,TRUE,NA,NA,NA,NA,NA,"Cancer defined by § 411.1(6). Presumed contracted while on active duty as a result of that duty. Pre-existing conditions known at membership commencement (on or after July 1, 1992) are excluded.",IA,Iowa,https://www.iaff.org/presumptive-health/ia/,2026-05-23,NA
cardiovascular,heart disease,firefighter,statute,TRUE,TRUE,Iowa Code § 411.6(5),NA,TRUE,NA,NA,NA,NA,NA,"Presumed contracted while on active duty as a result of strain. Pre-existing conditions known at membership commencement (on or after July 1, 1992) are excluded. Applies only to Chapter 411 retirement system members (police and firefighters in cities). Covers firefighters who passed regular civil service examination.",IA,Iowa,https://www.iaff.org/presumptive-health/ia/,2026-05-23,NA
respiratory,any disease of the lungs or respiratory tract,firefighter,statute,TRUE,TRUE,Iowa Code § 411.6(5),NA,TRUE,NA,NA,NA,NA,NA,"Presumed contracted while on active duty as result of inhalation of noxious fumes, poison, or gases. Pre-existing conditions known at membership commencement (on or after July 1, 1992) are excluded.",IA,Iowa,https://www.iaff.org/presumptive-health/ia/,2026-05-23,NA
infectious,"HIV/AIDS, all strains of hepatitis, meningococcal meningitis, mycobacterium tuberculosis",firefighter,statute,TRUE,TRUE,Iowa Code § 411.6(5); § 411.1(11),NA,TRUE,NA,NA,NA,NA,NA,"Infectious disease defined by § 411.1(11). Presumed contracted while on active duty as a result of that duty. Pre-existing conditions known at membership commencement (on or after July 1, 1992) are excluded.",IA,Iowa,https://www.iaff.org/presumptive-health/ia/,2026-05-23,NA
cancer,"brain cancer (10 yrs), bladder cancer (12 yrs), kidney cancer (15 yrs), colorectal cancer (10 yrs), non-Hodgkin's lymphoma (15 yrs), leukemia (5 yrs), mesothelioma (10 yrs), testicular cancer (5 yrs, age <40), breast cancer (5 yrs, age <40), esophageal cancer (10 yrs), multiple myeloma (15 yrs)",firefighter,statute,TRUE,TRUE,Idaho Code § 72-438 (firefighter occupational diseases subsection),5,TRUE,120,NA,FALSE,Presumption does not apply to any disease diagnosed more than 10 years following the last date on which the firefighter actually worked as a firefighter,TRUE,Each cancer type has its own minimum years-of-service threshold (5-15 years). 'Firefighter' = employee whose primary duty is extinguishing or investigating fires. Pre-employment medical screening exam must not have revealed the disease. Presumption is rebuttable by substantial evidence. Post-termination window is 10 years (120 months) from last date worked. Tobacco exclusion: presumption does not apply if firefighter or firefighter's cohabitant has regularly and habitually used tobacco products for 10+ years prior to diagnosis. Testicular cancer: age <40 and no evidence of anabolic steroids or human growth hormone use. Breast cancer: age <40 without breast cancer genetic predisposition.,ID,Idaho,https://www.iaff.org/presumptive-health/id/,2026-05-23,NA
cardiovascular,cardiovascular or pulmonary diseases,firefighter,statute,TRUE,NA,Idaho Code § 72-438,4,NA,NA,NA,NA,NA,NA,"Covers paid firemen employed by a municipality, village or fire district as regular members. Caused by overexertion in times of stress or danger OR by proximate exposure OR cumulative exposure over 4+ years to heat, smoke, chemical fumes or toxic gases. Applies to paid firefighters only (not volunteers). Covered diseases are not subject to the limitations of § 72-439.",ID,Idaho,https://www.iaff.org/presumptive-health/id/,2026-05-23,NA
respiratory,pulmonary or respiratory diseases,firefighter,statute,TRUE,NA,Idaho Code § 72-438,4,NA,NA,NA,NA,NA,NA,"Covers paid firemen employed by municipality, village or fire district as regular members. Caused by overexertion or cumulative exposure over 4+ years to heat, smoke, chemical fumes or toxic gases. Paid firefighters only.",ID,Idaho,https://www.iaff.org/presumptive-health/id/,2026-05-23,NA
infectious,"AIDS, AIDS related complexes (ARC), other manifestations of HIV infection, infectious hepatitis viruses, tuberculosis",firefighter,statute,TRUE,NA,Idaho Code § 72-438,NA,NA,NA,NA,NA,NA,NA,"Applies to occupations involving exposure to human blood or body fluids, which encompasses firefighters. No specific service minimum stated for this provision.",ID,Idaho,https://www.iaff.org/presumptive-health/id/,2026-05-23,NA
mental,post-traumatic stress injury (PTSD or PTSI per DSM-5),firefighter,statute,TRUE,TRUE,Idaho Code § 72-451(4)-(6),NA,NA,NA,NA,NA,NA,NA,"Requires diagnosis by a psychologist, licensed psychiatrist, or counselor trained in PTSI; and clear and convincing evidence the injury was caused by an event or events arising out of employment. Originally had a sunset of July 1, 2023 (Section 2 of the act), but effective for dates of injury/manifestation on or after July 1, 2019. Applies to firefighters as defined in §§ 59-1391(f) and 72-1403(A).",ID,Idaho,https://www.iaff.org/presumptive-health/id/,2026-05-23,NA
mental,post-traumatic stress injury (PTSD or PTSI per DSM-5),emt_paramedic,statute,TRUE,TRUE,Idaho Code § 72-451(4)-(6),NA,NA,NA,NA,NA,NA,NA,"Applies to EMS providers certified under §§ 56-1011 through 56-1018B and ambulance-based clinicians. Requires PTSI diagnosis and clear and convincing evidence. Originally had a sunset of July 1, 2023. Effective for dates of injury/manifestation on or after July 1, 2019.",ID,Idaho,https://www.iaff.org/presumptive-health/id/,2026-05-23,NA
mental,post-traumatic stress injury (PTSD or PTSI per DSM-5),law_enforcement,statute,TRUE,TRUE,Idaho Code § 72-451(4)-(6),NA,NA,NA,NA,NA,NA,NA,"Applies to peace officers (city, county, Idaho state police) as defined in § 19-5101(d). Requires PTSI diagnosis and clear and convincing evidence. Originally had a sunset of July 1, 2023. Effective for dates of injury/manifestation on or after July 1, 2019.",ID,Idaho,https://www.iaff.org/presumptive-health/id/,2026-05-23,NA
cancer,"disabling cancer that may be caused by exposure to heat, radiation, or a known carcinogen as defined by IARC",firefighter,statute,TRUE,TRUE,40 ILCS 5/4-110.1; 40 ILCS 5/6-151.1; 820 ILCS 305; 820 ILCS 310,5,TRUE,NA,NA,TRUE,Cancer must develop or manifest during period while firefighter is in service (pension provisions). 5-year minimum at time of filing Application for Adjustment of Claim (WC/OD Acts).,NA,"Cancer type must be one that may be caused by exposure to heat, radiation, or a known IARC carcinogen (4-110.1 and WC/OD Acts). Pre-employment exam: if exam discloses existence of cancer, firefighter loses entitlement until subsequent exam shows no cancer. Article 6 (cities over 500K) requires 7 years.",IL,Illinois,https://www.iaff.org/presumptive-health/il/,2026-05-23,NA
cancer,"cancer caused by exposure to heat, radiation, or IARC-defined carcinogen",emt_paramedic,statute,TRUE,TRUE,820 ILCS 305; 820 ILCS 310,5,NA,NA,NA,NA,5-year minimum at time of filing Application for Adjustment of Claim.,NA,"Covers EMT, EMT-I, A-EMT, and paramedic. Private-employer/medical-transfer exclusion applies.",IL,Illinois,https://www.iaff.org/presumptive-health/il/,2026-05-23,NA
cardiovascular,"heart disease, stroke",firefighter,statute,TRUE,TRUE,"40 ILCS 5/4-110.1 (municipalities 500,000 and under); 40 ILCS 5/6-151.1 (cities over 500,000); 820 ILCS 305 (Workers' Compensation Act); 820 ILCS 310 (Workers' Occupational Diseases Act)",5,TRUE,NA,NA,TRUE,Presumption does not apply to employees with less than 5 years at time of filing Application for Adjustment of Claim with IL WCC (820 ILCS 305/310). Pension provisions require disease to develop/manifest during active service.,NA,"Pension provisions (40 ILCS 5/4-110.1 and 6-151.1) require 5 years (Article 4) or 7 years (Article 6) of service, active status, and disease to manifest during service. Article 4 applies to municipalities 500K and under; Article 6 to cities over 500K (7-year minimum). WC/OD Acts (820 ILCS 305/310) require 5 years employment at time of filing Application for Adjustment of Claim. Pre-employment exam required under pension provisions: if exam shows impairment, firefighter loses entitlement until subsequent exam shows no impairment.",IL,Illinois,https://www.iaff.org/presumptive-health/il/,2026-05-23,NA
cardiovascular,"heart or vascular disease or condition, hypertension",emt_paramedic,statute,TRUE,TRUE,820 ILCS 305; 820 ILCS 310,5,NA,NA,NA,NA,5-year minimum at time of filing Application for Adjustment of Claim with IL WCC.,NA,"WC/OD Acts cover EMT, EMT-I, A-EMT, and paramedic. Exclusion: presumption does NOT apply to EMT/A-EMT/paramedic employed by a private employer if the employee spends the preponderance of work time engaged in medical transfers between medical care facilities or non-emergency medical transfers.",IL,Illinois,https://www.iaff.org/presumptive-health/il/,2026-05-23,NA
respiratory,"tuberculosis, disease of the lungs or respiratory tract",firefighter,statute,TRUE,TRUE,40 ILCS 5/4-110.1; 40 ILCS 5/6-151.1; 820 ILCS 305; 820 ILCS 310,5,TRUE,NA,NA,TRUE,5-year employment minimum at time of filing for WC/OD Acts; disease must manifest during active service for pension provisions.,NA,"Tuberculosis and lung/respiratory disease covered under all four statutory provisions. Article 4 (5-year minimum), Article 6 (7-year minimum). Pre-employment exam required under pension provisions.",IL,Illinois,https://www.iaff.org/presumptive-health/il/,2026-05-23,NA
respiratory,"lung or respiratory disease or condition, tuberculosis",emt_paramedic,statute,TRUE,TRUE,820 ILCS 305; 820 ILCS 310,5,NA,NA,NA,NA,5-year minimum at time of filing Application for Adjustment of Claim.,NA,"Covers EMT, EMT-I, A-EMT, and paramedic. Private-employer/medical-transfer exclusion applies.",IL,Illinois,https://www.iaff.org/presumptive-health/il/,2026-05-23,NA
infectious,"AIDS, hepatitis C, bloodborne pathogens, MRSA (contagious staph infection)",firefighter,statute,TRUE,TRUE,40 ILCS 5/6-151.1; 820 ILCS 305; 820 ILCS 310,5,TRUE,NA,NA,TRUE,Article 6 requires disease during active service. WC/OD Acts require 5 years at time of filing.,NA,"AIDS and hepatitis C covered in Article 6 (cities over 500K; 7-year minimum) and WC/OD Acts. MRSA covered under all three WC/OD-related provisions. Pre-employment exam required under Article 6: if exam discloses AIDS, hepatitis C, or MRSA, firefighter loses entitlement until subsequent exam shows no impairment.",IL,Illinois,https://www.iaff.org/presumptive-health/il/,2026-05-23,NA
infectious,"bloodborne pathogens, MRSA (contagious staph infection), tuberculosis",emt_paramedic,statute,TRUE,TRUE,820 ILCS 305; 820 ILCS 310,5,NA,NA,NA,NA,5-year minimum at time of filing Application for Adjustment of Claim.,NA,"Covers EMT, EMT-I, A-EMT, and paramedic. Private-employer/medical-transfer exclusion applies.",IL,Illinois,https://www.iaff.org/presumptive-health/il/,2026-05-23,NA
mental,post-traumatic stress disorder (PTSD),firefighter,statute,TRUE,NA,40 ILCS 5/4-112,NA,NA,NA,NA,NA,NA,NA,"Section 4-112 provides special protections for firefighters receiving disability pensions for PTSD: mandatory annual medical re-examination may be discontinued if firefighter has reached age 45, has documentation from 2+ physicians approving discontinuance, and board votes affirmatively. Also, no physical or mental disability forming the basis of a pension application may be used as cause for discharge by municipalities or fire protection districts.",IL,Illinois,https://www.iaff.org/presumptive-health/il/,2026-05-23,NA
other,"hernia, hearing loss",firefighter,statute,TRUE,TRUE,820 ILCS 305; 820 ILCS 310,5,NA,NA,NA,NA,5-year minimum at time of filing Application for Adjustment of Claim.,NA,Hernia and hearing loss explicitly included in the rebuttable presumption under both the Workers' Compensation Act and the Workers' Occupational Diseases Act.,IL,Illinois,https://www.iaff.org/presumptive-health/il/,2026-05-23,NA
other,"hernia, hearing loss",emt_paramedic,statute,TRUE,TRUE,820 ILCS 305; 820 ILCS 310,5,NA,NA,NA,NA,5-year minimum at time of filing Application for Adjustment of Claim.,NA,"Hernia and hearing loss explicitly included for EMT, EMT-I, A-EMT, and paramedic. Private-employer/medical-transfer exclusion applies.",IL,Illinois,https://www.iaff.org/presumptive-health/il/,2026-05-23,NA
cancer,exposure-related cancer — cancer caused by a known carcinogen to which an individual is at risk for occupational exposure (as recognized by IARC or NIOSH),firefighter,statute,TRUE,TRUE,IC 5-10-15-9,NA,NA,60,NA,FALSE,Former employee must have terminated employment not more than 60 months (5 years) before diagnosis; individual must be either actively employed or have terminated not more than 60 months earlier at time of diagnosis.,TRUE,Applies to full-time employees of state or political subdivision. Tobacco exclusion: chapter does not apply to any individual who used tobacco products in any form in the 5 years before diagnosis. At time of diagnosis: must be actively employed OR have terminated employment not more than 60 months earlier. Presumption is rebuttable by competent evidence.,IN,Indiana,https://www.iaff.org/presumptive-health/in/,2026-05-23,NA
cancer,exposure-related cancer — cancer caused by a known carcinogen to which an individual is at risk for occupational exposure,emt_paramedic,statute,TRUE,TRUE,IC 5-10-15-9,NA,NA,60,NA,FALSE,Must be actively employed or have terminated not more than 60 months before diagnosis.,TRUE,Applies to full-time emergency medical services providers as defined in IC 16-41-10-1. Tobacco exclusion: no tobacco use in the 5 years before diagnosis. Rebuttable by competent evidence.,IN,Indiana,https://www.iaff.org/presumptive-health/in/,2026-05-23,NA
cancer,exposure-related cancer — cancer caused by a known carcinogen to which an individual is at risk for occupational exposure,law_enforcement,statute,TRUE,TRUE,IC 5-10-15-9,NA,NA,60,NA,FALSE,Must be actively employed or have terminated not more than 60 months before diagnosis.,TRUE,Applies to full-time members of a police department as defined in IC 36-8-1-9. Tobacco exclusion: no tobacco use in the 5 years before diagnosis. Rebuttable by competent evidence.,IN,Indiana,https://www.iaff.org/presumptive-health/in/,2026-05-23,NA
cardiovascular,exposure-related heart or lung disease — disease or impairment of cardiovascular system caused by occupational exposure,firefighter,statute,TRUE,TRUE,IC 5-10-15-9,NA,NA,60,NA,FALSE,Must be actively employed or have terminated not more than 60 months before diagnosis.,TRUE,Full-time firefighters only. Tobacco exclusion: chapter does not apply to individuals who used tobacco in the 5 years before diagnosis. Rebuttable by competent evidence.,IN,Indiana,https://www.iaff.org/presumptive-health/in/,2026-05-23,NA
cardiovascular,exposure-related heart or lung disease — disease or impairment of cardiovascular system,emt_paramedic,statute,TRUE,TRUE,IC 5-10-15-9,NA,NA,60,NA,FALSE,Must be actively employed or have terminated not more than 60 months before diagnosis.,TRUE,Full-time EMS providers. Tobacco exclusion applies. Rebuttable by competent evidence.,IN,Indiana,https://www.iaff.org/presumptive-health/in/,2026-05-23,NA
cardiovascular,exposure-related heart or lung disease — disease or impairment of cardiovascular system,law_enforcement,statute,TRUE,TRUE,IC 5-10-15-9,NA,NA,60,NA,FALSE,Must be actively employed or have terminated not more than 60 months before diagnosis.,TRUE,Full-time law enforcement. Tobacco exclusion applies. Rebuttable by competent evidence.,IN,Indiana,https://www.iaff.org/presumptive-health/in/,2026-05-23,NA
respiratory,exposure-related lung disease — disease or impairment of respiratory system caused by occupational exposure,firefighter,statute,TRUE,TRUE,IC 5-10-15-9,NA,NA,60,NA,FALSE,Must be actively employed or have terminated not more than 60 months before diagnosis.,TRUE,Full-time firefighters only. Tobacco exclusion applies (no tobacco use in 5 years before diagnosis). Rebuttable by competent evidence.,IN,Indiana,https://www.iaff.org/presumptive-health/in/,2026-05-23,NA
respiratory,exposure-related lung disease — disease or impairment of respiratory system,emt_paramedic,statute,TRUE,TRUE,IC 5-10-15-9,NA,NA,60,NA,FALSE,Must be actively employed or have terminated not more than 60 months before diagnosis.,TRUE,Full-time EMS providers. Tobacco exclusion applies. Rebuttable by competent evidence.,IN,Indiana,https://www.iaff.org/presumptive-health/in/,2026-05-23,NA
respiratory,exposure-related lung disease — disease or impairment of respiratory system,law_enforcement,statute,TRUE,TRUE,IC 5-10-15-9,NA,NA,60,NA,FALSE,Must be actively employed or have terminated not more than 60 months before diagnosis.,TRUE,Full-time law enforcement. Tobacco exclusion applies. Rebuttable by competent evidence.,IN,Indiana,https://www.iaff.org/presumptive-health/in/,2026-05-23,NA
mental,mental illness / mental health disability (including PTSD),firefighter,statute,TRUE,NA,IC 36-8-8.3; IC 36-8-8-12.5; IC 36-8-8-13.1,NA,NA,NA,NA,NA,NA,NA,"Applies to 1977 Fund members (firefighters under IC 36-8-8). Mental health disability treated as Class 1 impairment (same as occupational disease). Mental health disability review panel process: initial 2-year provisional period with required active treatment; panel reevaluates at conclusion; second 2-year provisional period if still impaired; permanent disability after second evaluation if still impaired. Applies to final determinations after December 31, 2012. Employer pays for mental health care during both provisional periods. This is a pension/disability benefit structure, not a WC presumption per se.",IN,Indiana,https://www.iaff.org/presumptive-health/in/,2026-05-23,NA
mental,mental illness / mental health disability (including PTSD),law_enforcement,statute,TRUE,NA,IC 36-8-8.3; IC 36-8-8-12.5; IC 36-8-8-13.1,NA,NA,NA,NA,NA,NA,NA,Applies to 1977 Fund members (police officers and firefighters under IC 36-8-8). Review panel includes active or retired police officer or firefighter depending on the fund member being evaluated. Same provisional period structure as for firefighters. Employer pays for mental health care during provisional periods.,IN,Indiana,https://www.iaff.org/presumptive-health/in/,2026-05-23,NA
other,exposure-related Parkinson's disease — caused by a toxin or head trauma known to increase risk for Parkinson's disease,firefighter,statute,TRUE,TRUE,IC 5-10-15-5.5; IC 5-10-15-9,NA,NA,60,NA,FALSE,Must be actively employed or have terminated not more than 60 months before diagnosis.,TRUE,Parkinson's disease explicitly added as a presumptive condition (IC 5-10-15-5.5 added by P.L.59-2009). Must be caused by toxin or head trauma known to increase Parkinson's risk AND to which individual is at risk for occupational exposure. Tobacco exclusion applies. Rebuttable by competent evidence.,IN,Indiana,https://www.iaff.org/presumptive-health/in/,2026-05-23,NA
other,exposure-related Parkinson's disease,emt_paramedic,statute,TRUE,TRUE,IC 5-10-15-5.5; IC 5-10-15-9,NA,NA,60,NA,FALSE,Must be actively employed or have terminated not more than 60 months before diagnosis.,TRUE,Full-time EMS providers. Tobacco exclusion applies. Rebuttable by competent evidence.,IN,Indiana,https://www.iaff.org/presumptive-health/in/,2026-05-23,NA
other,exposure-related Parkinson's disease,law_enforcement,statute,TRUE,TRUE,IC 5-10-15-5.5; IC 5-10-15-9,NA,NA,60,NA,FALSE,Must be actively employed or have terminated not more than 60 months before diagnosis.,TRUE,Full-time law enforcement. Tobacco exclusion applies. Rebuttable by competent evidence.,IN,Indiana,https://www.iaff.org/presumptive-health/in/,2026-05-23,NA
cancer,"cancer which may result from exposure to heat, radiation, or a known carcinogen",firefighter,statute,TRUE,TRUE,K.S.A. 74-4952,5,NA,NA,NA,NA,NA,NA,"Cancer presumption limited to types that 'may, in general, result from exposure to heat, radiation, or a known carcinogen.' Same re-entry restriction applies. Part of KPERS pension system.",KS,Kansas,https://www.iaff.org/presumptive-health/ks/,2026-05-23,NA
cancer,"cancer which may result from exposure to heat, radiation, or a known carcinogen",law_enforcement,statute,TRUE,TRUE,K.S.A. 74-4952,5,NA,NA,NA,NA,NA,NA,"Same statute covers 'policeman or fire fighter.' Cancer limited to types resulting from heat, radiation, or known carcinogen exposure. Part of KPERS pension system.",KS,Kansas,https://www.iaff.org/presumptive-health/ks/,2026-05-23,NA
cardiovascular,heart disease,firefighter,statute,TRUE,TRUE,K.S.A. 74-4952,5,NA,NA,NA,NA,NA,NA,"Presumption applies after 5 years of credited service. If member ceased being a contributing member due to service-connected disability for 6+ months and then rejoined, the presumption for heart/lung/cancer does not apply again until re-contributing for 2 years or clear evidence of duty-connection. Presumption is part of pension/retirement system (KPERS), not standalone WC statute. Burden shifts to member or other party once employer presents contrary evidence.",KS,Kansas,https://www.iaff.org/presumptive-health/ks/,2026-05-23,NA
cardiovascular,heart disease,law_enforcement,statute,TRUE,TRUE,K.S.A. 74-4952,5,NA,NA,NA,NA,NA,NA,Same statute covers 'policeman or fire fighter.' Presumption applies after 5 years of credited service. Re-entry restriction after service-connected disability gap of 6+ months (must re-contribute 2 years before presumption re-activates). Part of KPERS pension system.,KS,Kansas,https://www.iaff.org/presumptive-health/ks/,2026-05-23,NA
respiratory,disease of the lung or respiratory tract,firefighter,statute,TRUE,TRUE,K.S.A. 74-4952,5,NA,NA,NA,NA,NA,NA,Presumption applies after 5 years of credited service. Same re-entry restriction as cardiovascular row. Part of KPERS pension system.,KS,Kansas,https://www.iaff.org/presumptive-health/ks/,2026-05-23,NA
respiratory,disease of the lung or respiratory tract,law_enforcement,statute,TRUE,TRUE,K.S.A. 74-4952,5,NA,NA,NA,NA,NA,NA,Same statute covers 'policeman or fire fighter.' Presumption applies after 5 years of credited service. Part of KPERS pension system.,KS,Kansas,https://www.iaff.org/presumptive-health/ks/,2026-05-23,NA
