condition_category,condition_specific,responder_type,presumption_type,presumption_exists,rebuttable,statute_citation,years_service_required,pre_employment_exam_required,post_termination_months,post_termination_formula,discovery_during_employment_required,filing_deadline_notes,tobacco_exclusion,notes,state,state_name,iaff_url,data_retrieved,needs_verification
infectious,"infectious disease: hepatitis, HIV, meningitis, tuberculosis",firefighter,statute,TRUE,TRUE,"Oklahoma Statutes Title 11, § 49-110",NA,TRUE,NA,NA,NA,NA,NA,"Infectious disease provisions effective November 10, 1999. Defined: hepatitis, HIV, meningitis, tuberculosis. No presumption if member fails to submit evidence of pre-employment physical. Rebuttable by competent evidence.",OK,Oklahoma,https://www.iaff.org/presumptive-health/ok/,2026-05-23,NA
cancer,"brain cancer, colon cancer, stomach cancer, testicular cancer, prostate cancer, multiple myeloma, non-Hodgkin's lymphoma, cancer of the throat or mouth, rectal cancer, breast cancer, leukemia, bladder cancer, gynecologic cancer (uterus, fallopian tubes, ovaries, cervix, vagina, vulva)",firefighter,statute,TRUE,TRUE,Oregon Revised Statutes § 656.802(5)(b),5,TRUE,84,NA,FALSE,Presumption does not apply to claims filed more than 84 months (7 years) after termination of nonvolunteer firefighter employment,TRUE,"Applies only to NONVOLUNTEER firefighters (paid at or above state minimum wage). Expressly does NOT apply to volunteer firefighters. Diagnosis must be first by physician after July 1, 2009. Prostate cancer presumption does not apply if first diagnosed after age 55 (claimant may still prove without presumption). Tobacco rebuttable by clear and convincing evidence that tobacco was major contributing cause. Denial must be based on clear and convincing evidence condition was not caused or contributed to in material part by employment.",OR,Oregon,https://www.iaff.org/presumptive-health/or/,2026-05-23,NA
cardiovascular,hypertension or cardiovascular-renal disease,firefighter,statute,TRUE,TRUE,Oregon Revised Statutes § 656.802(5)(a),5,TRUE,NA,NA,NA,NA,NA,Applies to firefighters of any political division with 5+ years employment. Pre-employment (or subsequent) physical must not have revealed evidence of condition. Denial must be based on clear and convincing medical evidence that cause is unrelated to employment. Amended by 2021 Act.,OR,Oregon,https://www.iaff.org/presumptive-health/or/,2026-05-23,NA
respiratory,disease of the lungs or respiratory tract,firefighter,statute,TRUE,TRUE,Oregon Revised Statutes § 656.802(5)(a),5,TRUE,NA,NA,NA,NA,NA,"Applies to firefighters of any political division with 5+ years employment. Pre-employment (or subsequent) physical must not have revealed evidence of condition. Denial must be based on clear and convincing medical evidence that cause is unrelated to employment. Amended by 2021 Act, applies to claims filed on or after effective date.",OR,Oregon,https://www.iaff.org/presumptive-health/or/,2026-05-23,NA
cancer,cancer caused by exposure to IARC Group 1 carcinogens,firefighter,statute,TRUE,TRUE,Pennsylvania Workers' Compensation Act § 108(r); Article III § 301(f),4,TRUE,NA,NA,NA,Claims may be made within 600 weeks (approx. 11.5 years) after last date of employment in exposed occupation; presumption itself only applies within first 300 weeks (approx. 5.75 years),NA,Requires 4+ years of continuous firefighting duties AND direct exposure to IARC Group 1 carcinogen AND pre-employment (or prior) physical showing no cancer. Volunteer fire company members covered but must document direct carcinogen exposure via Pennsylvania Fire Information Reporting System. Rebuttable by substantial competent evidence that cancer not caused by firefighting.,PA,Pennsylvania,https://www.iaff.org/presumptive-health/pa/,2026-05-23,NA
cancer,cancer caused by exposure to IARC Group 1 carcinogens,firefighter_volunteer,statute,TRUE,TRUE,Pennsylvania Workers' Compensation Act § 108(r); Article III § 301(f),4,TRUE,NA,NA,NA,Claims within 600 weeks of last exposed employment; presumption only applies within first 300 weeks,NA,Volunteer fire company members explicitly covered. Must document direct IARC Group 1 carcinogen exposure via Pennsylvania Fire Information Reporting System reports. Otherwise same requirements as career firefighters.,PA,Pennsylvania,https://www.iaff.org/presumptive-health/pa/,2026-05-23,NA
infectious,Hepatitis C,firefighter,statute,TRUE,TRUE,Pennsylvania Workers' Compensation Act § 108; Act 115 of 2001; 34 Pa. Code § 130.1,NA,TRUE,NA,NA,NA,NA,NA,"Covers professional and volunteer firefighters. Employer may rebut by establishing an employment screening program per Dept. guidelines and showing via testing that employee incurred Hep C prior to job-related exposure. Enacted December 20, 2001.",PA,Pennsylvania,https://www.iaff.org/presumptive-health/pa/,2026-05-23,NA
infectious,Hepatitis C,firefighter_volunteer,statute,TRUE,TRUE,Pennsylvania Workers' Compensation Act § 108; Act 115 of 2001; 34 Pa. Code § 130.1,NA,TRUE,NA,NA,NA,NA,NA,Expressly covers volunteer fire fighters and volunteer ambulance corps personnel and volunteer rescue/lifesaving squad personnel. Employer may rebut via employment screening program showing pre-job exposure.,PA,Pennsylvania,https://www.iaff.org/presumptive-health/pa/,2026-05-23,NA
infectious,Hepatitis C,emt_paramedic,statute,TRUE,TRUE,Pennsylvania Workers' Compensation Act § 108; Act 115 of 2001; 34 Pa. Code § 130.1,NA,TRUE,NA,NA,NA,NA,NA,Covers emergency medical services personnel and paramedics (including volunteer ambulance corps and rescue/lifesaving squad personnel). Employer may rebut via employment screening program.,PA,Pennsylvania,https://www.iaff.org/presumptive-health/pa/,2026-05-23,NA
infectious,Hepatitis C,law_enforcement,statute,TRUE,TRUE,Pennsylvania Workers' Compensation Act § 108; Act 115 of 2001; 34 Pa. Code § 130.1,NA,TRUE,NA,NA,NA,NA,NA,Covers Pennsylvania State Police officers and police officers requiring certification under 53 Pa.C.S. Chapter 21. Employer may rebut via employment screening program.,PA,Pennsylvania,https://www.iaff.org/presumptive-health/pa/,2026-05-23,NA
infectious,Hepatitis C,corrections,statute,TRUE,TRUE,Pennsylvania Workers' Compensation Act § 108; Act 115 of 2001; 34 Pa. Code § 130.1,NA,TRUE,NA,NA,NA,NA,NA,"Covers Commonwealth and county correctional employees, and forensic security employees of the Dept. of Public Welfare, with duties including care, custody and control of inmates involving exposure to Hepatitis C. Employer may rebut via employment screening program.",PA,Pennsylvania,https://www.iaff.org/presumptive-health/pa/,2026-05-23,NA
mental,post-traumatic stress injury (PTSI),firefighter,statute,TRUE,FALSE,"Pennsylvania Workers' Compensation Act §§ 109, 301(g); effective October 29, 2025",NA,NA,NA,NA,NA,"Claim must be filed within 3 years of diagnosis; injury must not have occurred more than 5 years before effective date (October 29, 2025)",NA,"Effective October 29, 2025. 'First responder' includes active volunteer or employed fire company member responding to emergency calls. PTSI must result from a 'qualifying traumatic event' (serious injury/death, child harm, life threat, mass casualties, crime scene). Must be diagnosed by licensed psychologist or psychiatrist. Benefits capped at 104 weeks. PTSI from disciplinary action or employment termination not compensable. Not required to be an 'abnormal working condition.'",PA,Pennsylvania,https://www.iaff.org/presumptive-health/pa/,2026-05-23,NA
mental,post-traumatic stress injury (PTSI),firefighter_volunteer,statute,TRUE,FALSE,"Pennsylvania Workers' Compensation Act §§ 109, 301(g); effective October 29, 2025",NA,NA,NA,NA,NA,Claim must be filed within 3 years of diagnosis; injury must not have occurred more than 5 years before effective date,NA,Active volunteers of qualifying fire companies explicitly included in 'first responder' definition. Same terms as career firefighters.,PA,Pennsylvania,https://www.iaff.org/presumptive-health/pa/,2026-05-23,NA
mental,post-traumatic stress injury (PTSI),emt_paramedic,statute,TRUE,FALSE,"Pennsylvania Workers' Compensation Act §§ 109, 301(g); effective October 29, 2025",NA,NA,NA,NA,NA,Claim must be filed within 3 years of diagnosis; injury must not have occurred more than 5 years before effective date,NA,Active volunteer or employed EMS provider (designated as primary municipal provider or dispatched by PSAP/under mutual aid) included in 'first responder' definition. Benefits capped at 104 weeks.,PA,Pennsylvania,https://www.iaff.org/presumptive-health/pa/,2026-05-23,NA
mental,post-traumatic stress injury (PTSI),law_enforcement,statute,TRUE,FALSE,"Pennsylvania Workers' Compensation Act §§ 109, 301(g); effective October 29, 2025",NA,NA,NA,NA,NA,Claim must be filed within 3 years of diagnosis; injury must not have occurred more than 5 years before effective date,NA,Covers Pennsylvania State Police officers and peace officers (18 Pa.C.S. § 501) who respond to emergency calls. Benefits capped at 104 weeks.,PA,Pennsylvania,https://www.iaff.org/presumptive-health/pa/,2026-05-23,NA
cancer,any type of cancer (occupational cancer),firefighter,statute,TRUE,FALSE,"Rhode Island General Laws §§ 45-19.1-3, 45-19.1-4",2,TRUE,NA,NA,FALSE,NA,TRUE,"CONCLUSIVE (irrebuttable) presumption under § 45-19.1-4 — any type of cancer in a firefighter is conclusively presumed occupational. For firefighters hired AFTER July 22, 2020: presumption does not apply if (1) pre-employment physical revealed cancer, (2) fewer than 2 years of employment, or (3) regular/habitual tobacco use in 5 years prior to diagnosis. Applies retroactively to cancer claims pending on or after July 22, 2020. Covers active firefighters (during service) and retired municipal firefighters (§ 45-19.1-3 — covers retired members retroactively).",RI,Rhode Island,https://www.iaff.org/presumptive-health/ri/,2026-05-23,NA
cardiovascular,"heart disease, stroke, or hypertension",firefighter,statute,TRUE,TRUE,Rhode Island General Laws § 45-19-16.1,NA,TRUE,NA,NA,NA,NA,TRUE,"Rebuttable by clear and convincing evidence. For firefighters hired AFTER July 1, 2023: presumption does not apply if (1) pre-employment physical revealed heart disease or hypertension, or (2) firefighter regularly/habitually used tobacco products during the 5 years prior to diagnosis. No such restrictions for firefighters hired before July 1, 2023.",RI,Rhode Island,https://www.iaff.org/presumptive-health/ri/,2026-05-23,NA
respiratory,smoke inhalation of the lungs or respiratory tract resulting in total disability or death,firefighter,statute,TRUE,TRUE,Rhode Island General Laws § 45-19-16,NA,TRUE,NA,NA,NA,NA,NA,Covers uniformed members of PAID fire departments only. City or town may adopt this presumption by ordinance — not automatically statewide. Presumption is rebuttable by competent evidence. Pre-employment (or subsequent) physical must not have revealed evidence of condition.,RI,Rhode Island,https://www.iaff.org/presumptive-health/ri/,2026-05-23,NA
infectious,"infectious disease including HIV (HBV, HCV) and other transmissible diseases",firefighter,statute,TRUE,NA,"Rhode Island General Laws §§ 23-28.36-4, 23-28.36-2",NA,NA,NA,NA,TRUE,NA,NA,"Infectious disease defined as any condition transmissible by association with the sick or their secretions/excretions, excluding common cold; explicitly includes HIV, HBV, HCV. Disease must develop or manifest as a result of exposure during period while fire fighter or police officer is in service of department. Covers paid and volunteer fire departments. Entitles to occupational disability benefits under ch. 19 of title 45.",RI,Rhode Island,https://www.iaff.org/presumptive-health/ri/,2026-05-23,NA
infectious,"infectious disease including HIV (HBV, HCV) and other transmissible diseases",law_enforcement,statute,TRUE,NA,"Rhode Island General Laws §§ 23-28.36-4, 23-28.36-2",NA,NA,NA,NA,TRUE,NA,NA,Statute explicitly covers both fire fighters AND police officers. Disease must manifest during period of active service. Same definition of infectious disease as firefighter row.,RI,Rhode Island,https://www.iaff.org/presumptive-health/ri/,2026-05-23,NA
mental,post-traumatic stress disorder (PTSD),firefighter,statute,TRUE,TRUE,Rhode Island General Laws § 45-19-1(a)(2),NA,NA,NA,NA,NA,NA,NA,"PTSD must be diagnosed by licensed mental health professional with a master's degree. Must arise from exposure to potentially traumatic events in course of employment or off-duty emergency assistance within Rhode Island. Presumption is rebuttable by fair preponderance of evidence that PTSI/PTSD is not job-related. PTSD arising from disciplinary action, work evaluation, job transfer, layoff, demotion, termination or adverse job action not covered.",RI,Rhode Island,https://www.iaff.org/presumptive-health/ri/,2026-05-23,NA
mental,post-traumatic stress disorder (PTSD),law_enforcement,statute,TRUE,TRUE,Rhode Island General Laws § 45-19-1(a)(2),NA,NA,NA,NA,NA,NA,NA,"Explicitly covers police officers (including chiefs, municipal officers, deputy sheriffs, fugitive task force, capitol police, environmental police criminal investigators, airport police). Same terms as firefighters. PTSD from adverse job actions not covered.",RI,Rhode Island,https://www.iaff.org/presumptive-health/ri/,2026-05-23,NA
cancer,"malignant neoplasms of central/peripheral nervous system, oropharyngeal, respiratory tract, gastrointestinal tract, hepatobiliary, solid organ and endocrine, genitourinary and male reproductive, GYN, skin/soft tissue/breast, bone and blood",firefighter,statute,TRUE,NA,S.C. Code Ann. § 23-9-197,5,NA,NA,NA,NA,NA,NA,"This is a supplemental insurance benefit plan (not a WC presumption per se). Covers paid and unpaid (volunteer) firefighters. Requires 5 continuous years of service in a SC fire department and active service within 10 years of diagnosis. Benefits: up to $12,000/yr reimbursement for out-of-pocket expenses, $20,000 one-time initial-diagnosis benefit, $75,000 death benefit. Implementation contingent on funding. Effective July 1, 2021.",SC,South Carolina,https://www.iaff.org/presumptive-health/sc/,2026-05-23,NA
cardiovascular,heart disease,firefighter,statute,TRUE,TRUE,S.C. Code Ann. § 42-11-30(A),NA,TRUE,NA,NA,TRUE,Condition must have developed while actively engaged in fighting a fire or within 24 hours from the date of last service in the activity,NA,"Firefighter must be a bona fide member of a municipal, county, state, port authority, or fire control district fire department. Anyone joining after May 29, 1968 must have been under age 37 at entry and passed a physical exam showing no evidence of the condition. Condition must develop while actively fighting a fire or within 24 hours of last service.",SC,South Carolina,https://www.iaff.org/presumptive-health/sc/,2026-05-23,NA
cardiovascular,cardiac-related incident (cardiac impairment or injury),law_enforcement,statute,TRUE,TRUE,S.C. Code Ann. § 42-11-30(B),NA,TRUE,NA,NA,TRUE,"Impairment or injury must have developed while actively engaged in, or within 24 hours from the date of, a law enforcement incident involving unusual or extraordinary physical exertion",NA,"Officer must be employed by a municipal, county, state, port authority, or other law enforcement agency. Must be under age 37 at entry and have passed a physical exam with risk factor assessment for coronary artery disease. If identified as high-risk but fails to undergo additional tests at own expense, loses entitlement to presumption. Cardiac incident must occur during or within 24 hours of a law enforcement incident involving unusual/extraordinary physical exertion.",SC,South Carolina,https://www.iaff.org/presumptive-health/sc/,2026-05-23,NA
respiratory,respiratory disease,firefighter,statute,TRUE,TRUE,S.C. Code Ann. § 42-11-30(A),NA,TRUE,NA,NA,TRUE,Condition must have developed while actively engaged in fighting a fire or within 24 hours from the date of last service in the activity,NA,"Firefighter must be a bona fide member of a municipal, county, state, port authority, or fire control district fire department. Anyone joining after May 29, 1968 must have been under age 37 at entry and passed a physical exam showing no evidence of the condition. Condition must develop while actively fighting a fire or within 24 hours of last service.",SC,South Carolina,https://www.iaff.org/presumptive-health/sc/,2026-05-23,NA
cancer,cancer (any impairment of health caused by cancer),firefighter,statute,TRUE,NA,S.D. Codified Laws § 9-16-3.3,NA,TRUE,NA,NA,NA,NA,NA,This section pertains solely to pension matters under Chapter 9-16 and does not restrict claimant's ability to file for benefits under chapter 62-8 or change the burden of proof established in § 62-8-12. Applies to officers or members of a fire department. Pre-employment physical must have failed to reveal any evidence of cancer.,SD,South Dakota,https://www.iaff.org/presumptive-health/sd/,2026-05-23,NA
cardiovascular,"hypertension, heart disease",firefighter,statute,TRUE,TRUE,S.D. Codified Laws § 9-16-45,NA,TRUE,NA,NA,NA,NA,NA,Applies to officers or members of a fire department. Pre-employment physical must have failed to reveal any evidence of the condition. Presumed to have been suffered in line of duty unless contrary shown by competent evidence.,SD,South Dakota,https://www.iaff.org/presumptive-health/sd/,2026-05-23,NA
respiratory,respiratory disease,firefighter,statute,TRUE,TRUE,S.D. Codified Laws § 9-16-45,NA,TRUE,NA,NA,NA,NA,NA,Applies to officers or members of a fire department. Pre-employment physical must have failed to reveal any evidence of the condition. Presumed to have been suffered in line of duty unless contrary shown by competent evidence.,SD,South Dakota,https://www.iaff.org/presumptive-health/sd/,2026-05-23,NA
cancer,"Non-Hodgkin's Lymphoma, colon cancer, skin cancer, leukemia, testicular cancer, multiple myeloma, prostate cancer, breast cancer, pancreatic cancer",firefighter,statute,TRUE,TRUE,Tenn. Code Ann. § 7-51-201(d),5,TRUE,60,NA,NA,May use presumption for up to 5 years after most recent date of qualifying exposure,NA,"Applies to full-time paid firefighters in fire departments recognized by state fire marshal's office and manned by full-time paid employees. Must have 5+ consecutive years of service. Must have been exposed to heat, smoke, fumes, or carcinogenic/poisonous/toxic/chemical substances while performing firefighter duties. Cancer screening exams required by condition type: NHL/colon/skin/multiple myeloma exam required after July 1 2019; leukemia/testicular exam required after July 1 2022; prostate/breast/pancreatic exam required after July 1 2025. Secondary employment or lifestyle habits may be considered. Rebuttable by competent medical evidence; oncologist (board certified) for death claims.",TN,Tennessee,https://www.iaff.org/presumptive-health/tn/,2026-05-23,NA
cancer,disease or cancer (broad — any disease or cancer),firefighter,statute,TRUE,TRUE,Tenn. Code Ann. § 7-51-205,NA,TRUE,NA,NA,NA,NA,NA,"Applies only to counties with a metropolitan form of government with population 400,000+ (per 1980 or subsequent federal census) — effectively Nashville/Davidson County. Applies to full-time firefighters required to work in toxic environments. May be established by ordinance. Pre-employment physical must have failed to reveal evidence of cancer. Does not affect rights under § 7-51-201.",TN,Tennessee,https://www.iaff.org/presumptive-health/tn/,2026-05-23,NA
cardiovascular,"hypertension, heart disease",firefighter,statute,TRUE,TRUE,Tenn. Code Ann. § 7-51-201(b),NA,TRUE,NA,NA,NA,NA,NA,"Applies to full-time employees of a regular fire department in a state, municipal corporation, or political subdivision that has established compensation beyond workers' compensation. Pre-employment physical must have failed to reveal evidence of the condition.",TN,Tennessee,https://www.iaff.org/presumptive-health/tn/,2026-05-23,NA
cardiovascular,"hypertension, heart disease",emt_paramedic,statute,TRUE,TRUE,Tenn. Code Ann. § 7-51-201(c),NA,TRUE,NA,NA,NA,NA,NA,"Applies to EMTs and paramedics employed by a county with population over 400,000 (per 1980 or subsequent federal census) or a municipal corporation within such county, within the fire department, where compensation beyond WC has been established. Pre-employment physical must have failed to reveal evidence of condition.",TN,Tennessee,https://www.iaff.org/presumptive-health/tn/,2026-05-23,NA
respiratory,disease of the lungs,firefighter,statute,TRUE,TRUE,Tenn. Code Ann. § 7-51-201(b),NA,TRUE,NA,NA,NA,NA,NA,"Applies to full-time employees of a regular fire department in a state, municipal corporation, or political subdivision that has established compensation beyond workers' compensation. Pre-employment physical must have failed to reveal evidence of the condition. Contrary shown by competent medical evidence.",TN,Tennessee,https://www.iaff.org/presumptive-health/tn/,2026-05-23,NA
infectious,"HIV (human immunodeficiency virus), hepatitis C virus",firefighter,statute,TRUE,TRUE,Tenn. Code Ann. § 7-51-209,NA,TRUE,12,NA,FALSE,Incident/accident report must be filed within 7 days of the exposure event. Post-termination coverage for 1 year from last actual date of service.,NA,"Applies to full-time firefighters, paramedics, EMTs employed by state or political subdivision. Requires prior negative test for infectious disease before diagnosis. Worker must file a sworn declaration that they have not engaged in any high-risk behavior (outside-employment exposure, unsafe sexual practices, IV drug use, blood transfusion). Post-termination coverage: 1 year from last service date. Does not apply to death benefits under Tennessee consolidated retirement system or state death benefit. Pre-employment HIV testing required from July 1 2012; all infectious diseases from July 1 2015.",TN,Tennessee,https://www.iaff.org/presumptive-health/tn/,2026-05-23,NA
infectious,"HIV (human immunodeficiency virus), hepatitis C virus",emt_paramedic,statute,TRUE,TRUE,Tenn. Code Ann. § 7-51-209,NA,TRUE,12,NA,FALSE,Incident/accident report must be filed within 7 days of the exposure event. Post-termination coverage for 1 year from last actual date of service.,NA,Applies to full-time paramedics and EMTs employed by state or political subdivision. Same terms as firefighter row under § 7-51-209. Requires prior negative test for infectious disease. Worker must file a sworn declaration excluding high-risk behaviors. Post-termination coverage: 1 year from last service date.,TN,Tennessee,https://www.iaff.org/presumptive-health/tn/,2026-05-23,NA
mental,PTSD (post-traumatic stress disorder),firefighter,statute,FALSE,NA,Tenn. Code Ann. § 8-50-119,NA,NA,NA,NA,NA,NA,NA,"Tennessee Public Safety Behavioral Health Act requires public safety employers (including those employing firefighters and EMTs) to provide at least 10 PTSD treatment sessions via health benefits, maintain lists of qualified mental health providers, and prohibit retaliation. This is a treatment access mandate, NOT a WC presumption. Does not apply to workers' compensation plans under title 50. Effective July 1, 2018.",TN,Tennessee,https://www.iaff.org/presumptive-health/tn/,2026-05-23,NA
mental,PTSD (post-traumatic stress disorder),emt_paramedic,statute,FALSE,NA,Tenn. Code Ann. § 8-50-119,NA,NA,NA,NA,NA,NA,NA,"Same as firefighter row — Tennessee Public Safety Behavioral Health Act applies to 'public safety employees' defined as emergency medical workers and professional firefighters. Treatment access mandate only, not a WC presumption. Effective July 1, 2018.",TN,Tennessee,https://www.iaff.org/presumptive-health/tn/,2026-05-23,NA
cancer,"stomach, colon, rectum, skin, prostate, testis, or brain cancer; non-Hodgkin's lymphoma; multiple myeloma; malignant melanoma; renal cell carcinoma",firefighter,statute,TRUE,TRUE,Tex. Gov't Code § 607.055,5,TRUE,NA,NA,TRUE,NA,TRUE,"Firefighter must have regularly responded on scene to fire calls, OR regularly responded to an event involving documented release of radiation or a known/suspected carcinogen. Rebuttal per § 607.058 requires preponderance of evidence; ALJ must consider whether a qualified expert relying on evidence-based medicine stated the opinion. Tobacco exclusion: disease known to be caused by tobacco use bars the presumption if firefighter/EMT or smoking spouse used tobacco.",TX,Texas,https://www.iaff.org/presumptive-health/tx/,2026-05-23,NA
cancer,"stomach, colon, rectum, skin, prostate, testis, or brain cancer; non-Hodgkin's lymphoma; multiple myeloma; malignant melanoma; renal cell carcinoma",firefighter_volunteer,statute,TRUE,TRUE,"Tex. Gov't Code §§ 607.052(f), 607.055",5,TRUE,NA,NA,TRUE,NA,TRUE,Volunteer firefighters explicitly covered under § 607.052(f). Must participate in minimum 40% of drills and 25% of fire or emergency calls while on call. Must have regularly responded to fire calls or events involving radiation/carcinogens. Same terms as paid firefighter row under § 607.055.,TX,Texas,https://www.iaff.org/presumptive-health/tx/,2026-05-23,NA
cancer,"stomach, colon, rectum, skin, prostate, testis, or brain cancer; non-Hodgkin's lymphoma; multiple myeloma; malignant melanoma; renal cell carcinoma",emt_paramedic,statute,TRUE,TRUE,Tex. Gov't Code § 607.055,5,TRUE,NA,NA,TRUE,NA,TRUE,Same terms as firefighter row under § 607.055. Tobacco exclusion applies.,TX,Texas,https://www.iaff.org/presumptive-health/tx/,2026-05-23,NA
